{
  "closure_evidence_nodes": {
    "coverage_gate": {
      "filename": "coverage-gate.json",
      "pass": false,
      "present": true,
      "sha256": "e04bcc092eeca703d9d69488584841f1d16e469fad0b5b7e26d144ea4557d3eb",
      "status": "FAIL"
    },
    "freeze_1_validation": {
      "filename": "corpus-freeze-1.validation.json",
      "pass": false,
      "present": true,
      "sha256": "1448e30e70b70d63f2c2fff0ca249a140c819a25915821687a1839c008dc8bb4",
      "status": "FAIL"
    },
    "freeze_2_validation": {
      "filename": "corpus-freeze-2.validation.json",
      "pass": false,
      "present": true,
      "sha256": "01f03fc0b5027ac44dfff4d2f850e9eee643b175586f90bd0cdcbb1752849f3e",
      "status": "FAIL"
    },
    "global_dedup_audit": {
      "filename": "global-dedup-audit.json",
      "pass": true,
      "present": true,
      "sha256": "9d7e7b49774e2daf720dd499638869f0454a02f14ae0a1233931d8434cd9f9b2",
      "status": "PASS"
    },
    "recording_family_audit": {
      "filename": "recording-family-audit.json",
      "pass": true,
      "present": true,
      "sha256": "1e7aebe2b25b3f89929ca31e48e658061187b65ca90a02a85dda2b166cd93439",
      "status": "PASS"
    },
    "reproducibility": {
      "filename": "corpus-reproducibility.json",
      "pass": false,
      "present": true,
      "sha256": "8a6a69fbc51bb3cc0d73d92551f40ff048947fc4f120b6e11a3b057dc60769a6",
      "status": "FAIL"
    },
    "split_integrity": {
      "filename": "split-integrity.json",
      "pass": true,
      "present": true,
      "sha256": "216de3e151096657af6cab2abcb50700570bd4bc623ccff6428ebe48dff6d21c",
      "status": "PASS"
    }
  },
  "corpus_certificate": {
    "id": "CERT-MK1-DF-CORPUS-001",
    "status": "OPEN"
  },
  "eligible_for_certificate_review": false,
  "evidence_identity_sha256": "90f2dd006cfbacfe9dc1bdc5cb81c7d9411ccf5322d6ca2dd53f334e76c209e8",
  "gap_codes": [
    "CORPUS_CERTIFICATE_NOT_CERTIFIED",
    "COVERAGE_GATE_GAP_CODES_NOT_EMPTY",
    "COVERAGE_GATE_NOT_PASS",
    "COVERAGE_GATE_STATUS_NOT_PASS",
    "FIRE_ALARM_ASSETS_9_LT_50",
    "FIRE_ALARM_HARD_NEGATIVE_SOURCES_1_LT_2",
    "FREEZE_1_VALIDATION_NOT_PASS",
    "FREEZE_2_VALIDATION_NOT_PASS",
    "GLASS_SHATTER_HARD_NEGATIVE_SOURCES_1_LT_2",
    "REPRODUCIBILITY_NOT_PASS",
    "SIREN_HARD_NEGATIVE_SOURCES_1_LT_2",
    "TIRE_SQUEAL_ASSETS_11_LT_50",
    "TIRE_SQUEAL_HARD_NEGATIVES_0_LT_20",
    "TIRE_SQUEAL_HARD_NEGATIVE_SOURCES_0_LT_2",
    "VEHICLE_HORN_HARD_NEGATIVES_0_LT_20",
    "VEHICLE_HORN_HARD_NEGATIVE_SOURCES_0_LT_2"
  ],
  "inputs": {
    "canonical_ledger_summary": {
      "baseline_commit": "4b261bd10d6578a6256fca8ec848ea1055c24b32",
      "entry_count": 1078,
      "ledger_sha256": "36ef8e19198a296d7806106adc2c4ee43b7827d893e78b6bbd2d1ffd83b3743a",
      "sha256": "62a92067255bba011870c8297e0d242d8217672222e69034d9816dd59520e986"
    },
    "coverage_policy": {
      "policy_id": "MK1-CORPUS-SOLIDITY-001",
      "schema_version": "echo.coverage-policy.v1",
      "sha256": "bc45947df58b22608e3f0a1aec682105efa3b0b949e99251076639ff98a81d36"
    }
  },
  "ledger_blocking_reason_counts": {},
  "modeling_allowed": false,
  "next_authorized_stage": "CORPUS_FOUNDRY_CLOSURE",
  "profile": "release_safe",
  "readiness_id": "EMP-MK1-CORPUS-READINESS-001",
  "release_law": "NO CERT-MK1-DF-CORPUS-001 = NO Benchmark A/B/C, no YAMNet/PANNs/CNN, no EMP-MODEL-001, no threshold calibration, no replay pipeline, no real camera.",
  "schema_version": "echo.corpus-closure-readiness.v1",
  "status": "BLOCKED",
  "target_readiness": {
    "FIRE_ALARM": {
      "hard_negative_assets_floor": 20,
      "hard_negative_assets_pre_final_dedup": 34,
      "hard_negative_source_floor": 2,
      "hard_negative_underlying_source_families": 1,
      "positive_assets_floor": 50,
      "positive_assets_pre_final_dedup": 9,
      "positive_source_floor": 2,
      "positive_underlying_source_families": 2,
      "precheck_status": "FAIL",
      "scope_note": "Precheck only; final coverage also requires groups, duration, per-split floors, source concentration, quality, rights and duplicate controls."
    },
    "GLASS_SHATTER": {
      "hard_negative_assets_floor": 20,
      "hard_negative_assets_pre_final_dedup": 401,
      "hard_negative_source_floor": 2,
      "hard_negative_underlying_source_families": 1,
      "positive_assets_floor": 50,
      "positive_assets_pre_final_dedup": 304,
      "positive_source_floor": 2,
      "positive_underlying_source_families": 2,
      "precheck_status": "FAIL",
      "scope_note": "Precheck only; final coverage also requires groups, duration, per-split floors, source concentration, quality, rights and duplicate controls."
    },
    "SIREN": {
      "hard_negative_assets_floor": 20,
      "hard_negative_assets_pre_final_dedup": 32,
      "hard_negative_source_floor": 2,
      "hard_negative_underlying_source_families": 1,
      "positive_assets_floor": 50,
      "positive_assets_pre_final_dedup": 173,
      "positive_source_floor": 2,
      "positive_underlying_source_families": 3,
      "precheck_status": "FAIL",
      "scope_note": "Precheck only; final coverage also requires groups, duration, per-split floors, source concentration, quality, rights and duplicate controls."
    },
    "TIRE_SQUEAL": {
      "hard_negative_assets_floor": 20,
      "hard_negative_assets_pre_final_dedup": 0,
      "hard_negative_source_floor": 2,
      "hard_negative_underlying_source_families": 0,
      "positive_assets_floor": 50,
      "positive_assets_pre_final_dedup": 11,
      "positive_source_floor": 2,
      "positive_underlying_source_families": 2,
      "precheck_status": "FAIL",
      "scope_note": "Precheck only; final coverage also requires groups, duration, per-split floors, source concentration, quality, rights and duplicate controls."
    },
    "VEHICLE_HORN": {
      "hard_negative_assets_floor": 20,
      "hard_negative_assets_pre_final_dedup": 0,
      "hard_negative_source_floor": 2,
      "hard_negative_underlying_source_families": 0,
      "positive_assets_floor": 50,
      "positive_assets_pre_final_dedup": 245,
      "positive_source_floor": 2,
      "positive_underlying_source_families": 3,
      "precheck_status": "FAIL",
      "scope_note": "Precheck only; final coverage also requires groups, duration, per-split floors, source concentration, quality, rights and duplicate controls."
    }
  }
}
